dataInicio,dataFim,entidade,info
01/01/2018,01/01/2018,b'Feriado/Expediente Suspenso',b'Confraterniza\xc3\xa7\xc3\xa3o Universal.'
01/01/2018,01/01/2018,feriado/expediente suspenso,Confraternização Universal.
02/01/2018,03/01/2018,b'F\xc3\xa9rias de Ver\xc3\xa3o',b'Coordenadorias de Cursos adequam matr\xc3\xadculas do per\xc3\xadodo de \xc2\xa0F\xc3\xa9rias de Ver\xc3\xa3o - 2018.'
02/01/2018,03/01/2018,ferias de verao,Coordenadorias de Cursos adequam matrículas do período de  Férias de Verão - 2018.
02/01/2018,31/01/2018,b'Sistema de Recupera\xc3\xa7\xc3\xa3o',b'Per\xc3\xadodo das atividades do Sistema de Recupera\xc3\xa7\xc3\xa3o das disciplinas oferecidas no 2\xc2\xba per\xc3\xadodo letivo de 2017.'
02/01/2018,31/01/2018,sistema de recuperacao,Período das atividades do Sistema de Recuperação das disciplinas oferecidas no 2º período letivo de 2017.
02/01/2018,02/02/2018,b'Sistema de Recupera\xc3\xa7\xc3\xa3o',"b'Prazo para entrada das notas do Sistema de Recupera\xc3\xa7\xc3\xa3o das disciplinas oferecidas no 2\xc2\xba per\xc3\xadodo letivo de 2017, na WEB.'"
02/01/2018,02/02/2018,sistema de recuperacao,"Prazo para entrada das notas do Sistema de Recuperação das disciplinas oferecidas no 2º período letivo de 2017, na WEB."
04/01/2018,04/01/2018,b'F\xc3\xa9rias de Ver\xc3\xa3o',b'DAC divulga na WEB relat\xc3\xb3rios de matr\xc3\xadculas do per\xc3\xadodo de F\xc3\xa9rias de Ver\xc3\xa3o - 2018.'
04/01/2018,04/01/2018,ferias de verao,DAC divulga na WEB relatórios de matrículas do período de Férias de Verão - 2018.
04/01/2018,04/01/2018,Férias de Verão,Início das aulas do período de Férias de Verão - 2018
04/01/2018,21/02/2018,b'F\xc3\xa9rias de Ver\xc3\xa3o',"b'Prazo para entrada de M\xc3\xa9dias e Frequ\xc3\xaancias do per\xc3\xadodo de F\xc3\xa9rias de Ver\xc3\xa3o - 2018, na WEB.'"
04/01/2018,21/02/2018,ferias de verao,"Prazo para entrada de Médias e Frequências do período de Férias de Verão - 2018, na WEB."
09/01/2018,09/01/2018,b'Processo Seletivo Aberto',b'\xc3\x9altimo dia para as Coordenadorias de Cursos entregarem na DAC os resultados das Provas Espec\xc3\xadficas de Conhecimentos do Processo Seletivo Aberto para preenchimento de vagas remanescentes.'
09/01/2018,09/01/2018,processo seletivo aberto,Último dia para as Coordenadorias de Cursos entregarem na DAC os resultados das Provas Específicas de Conhecimentos do Processo Seletivo Aberto para preenchimento de vagas remanescentes.
12/01/2018,12/01/2018,b'Cola\xc3\xa7\xc3\xa3o de Grau',b'In\xc3\xadcio das Cola\xc3\xa7\xc3\xb5es de Grau \xc2\xa0do 2\xc2\xba per\xc3\xadodo letivo de 2017.'
12/01/2018,12/01/2018,colacao de grau,Início das Colações de Grau  do 2º período letivo de 2017.
12/01/2018,12/01/2018,Carta de Aceitação,"Último dia para as Coordenadorias de Cursos solicitarem à DAC, por e-mail, emissão da Carta de Aceitação para estudante especial estrangeiro para o 1º período letivo de 2018."
14/01/2018,16/01/2018,b'Vestibular Unicamp',b'Provas da 2\xc2\xaa fase do Vestibular Unicamp 2018.'
14/01/2018,16/01/2018,vestibular unicamp,Provas da 2ª fase do Vestibular Unicamp 2018.
19/01/2018,19/01/2018,b'Processo Seletivo Aberto',"b'Divulga\xc3\xa7\xc3\xa3o da lista de candidatos convocados para matr\xc3\xadcula do Processo Seletivo Aberto para preenchimento de vagas remanescentes, cursos sem Prova de Habilidades Espec\xc3\xadficas.'"
19/01/2018,19/01/2018,processo seletivo aberto,"Divulgação da lista de candidatos convocados para matrícula do Processo Seletivo Aberto para preenchimento de vagas remanescentes, cursos sem Prova de Habilidades Específicas."
19/01/2018,19/01/2018,Catálogo dos Cursos de Graduação,Coordenadorias de Cursos recebem os processos físicos para elaboração do Catálogo dos Cursos de Graduação para o ano de 2019.
22/01/2018,25/01/2018,b'Vestibular Unicamp',"b'Provas de Habilidades Espec\xc3\xadficas do Vestibular Unicamp 2018, exceto curso de M\xc3\xbasica.'"
22/01/2018,25/01/2018,vestibular unicamp,"Provas de Habilidades Específicas do Vestibular Unicamp 2018, exceto curso de Música."
22/01/2018,04/05/2018,b'Cat\xc3\xa1logo dos Cursos de Gradua\xc3\xa7\xc3\xa3o',"b'Coordenadorias de Cursos prop\xc3\xb5em altera\xc3\xa7\xc3\xb5es nos processos de elabora\xc3\xa7\xc3\xa3o do Cat\xc3\xa1logo dos Cursos de Gradua\xc3\xa7\xc3\xa3o para o ano de 2019, no SIGA.'"
22/01/2018,04/05/2018,catalogo dos cursos de graduacao,"Coordenadorias de Cursos propõem alterações nos processos de elaboração do Catálogo dos Cursos de Graduação para o ano de 2019, no SIGA."
24/01/2018,25/01/2018,b'Processo Seletivo Aberto',"b'Matr\xc3\xadcula e solicita\xc3\xa7\xc3\xa3o de Aproveitamento de Estudos para os candidatos aprovados no Processo Seletivo Aberto para preenchimento de vagas remanescentes, cursos sem Prova de Habilidades Espec\xc3\xadficas, na DAC.'"
24/01/2018,25/01/2018,processo seletivo aberto,"Matrícula e solicitação de Aproveitamento de Estudos para os candidatos aprovados no Processo Seletivo Aberto para preenchimento de vagas remanescentes, cursos sem Prova de Habilidades Específicas, na DAC."
29/01/2018,01/02/2018,b'Adequa\xc3\xa7\xc3\xa3o de Matr\xc3\xadcula',b'Coordenadorias de Cursos encaminham \xc3\xa0 DAC a rela\xc3\xa7\xc3\xa3o dos docentes que ministrar\xc3\xa3o as disciplinas abertas no per\xc3\xadodo de Adequa\xc3\xa7\xc3\xa3o de Matr\xc3\xadculas do 1\xc2\xba per\xc3\xadodo letivo de 2018.'
29/01/2018,01/02/2018,adequacao de matricula,Coordenadorias de Cursos encaminham à DAC a relação dos docentes que ministrarão as disciplinas abertas no período de Adequação de Matrículas do 1º período letivo de 2018.
29/01/2018,02/02/2018,b'Adequa\xc3\xa7\xc3\xa3o de Matr\xc3\xadcula',b'Coordenadorias de Cursos adequam matr\xc3\xadculas do 1\xc2\xba per\xc3\xadodo letivo de 2018.'
29/01/2018,02/02/2018,adequacao de matricula,Coordenadorias de Cursos adequam matrículas do 1º período letivo de 2018.
01/02/2018,01/02/2018,b'Adequa\xc3\xa7\xc3\xa3o de Matr\xc3\xadcula',b'\xc3\x9altimo dia para as Coordenadorias de Cursos encaminharem \xc3\xa0 DAC a rela\xc3\xa7\xc3\xa3o dos docentes que ministrar\xc3\xa3o as disciplinas abertas no per\xc3\xadodo de Adequa\xc3\xa7\xc3\xa3o de Matr\xc3\xadculas do 1\xc2\xba per\xc3\xadodo letivo de 2018.'
01/02/2018,01/02/2018,adequacao de matricula,Último dia para as Coordenadorias de Cursos encaminharem à DAC a relação dos docentes que ministrarão as disciplinas abertas no período de Adequação de Matrículas do 1º período letivo de 2018.
02/02/2018,02/02/2018,b'Sistema de Recupera\xc3\xa7\xc3\xa3o',"b'\xc3\x9altimo dia para entrada das notas do Sistema de Recupera\xc3\xa7\xc3\xa3o das disciplinas oferecidas no 2\xc2\xba per\xc3\xadodo letivo de 2017, na WEB.'"
02/02/2018,02/02/2018,sistema de recuperacao,"Último dia para entrada das notas do Sistema de Recuperação das disciplinas oferecidas no 2º período letivo de 2017, na WEB."
02/02/2018,02/02/2018,Adequação de Matrícula,Último dia para as Coordenadorias de Cursos adequarem matrículas do 1º período letivo de 2018.
05/02/2018,05/02/2018,b'Per\xc3\xadodo Letivo',b'In\xc3\xadcio das aulas das disciplinas de cl\xc3\xadnica da Faculdade de Odontologia de Piracicaba.'
05/02/2018,05/02/2018,periodo letivo,Início das aulas das disciplinas de clínica da Faculdade de Odontologia de Piracicaba.
05/02/2018,05/02/2018,Período Letivo,Início das aulas das disciplinas de estágio do Curso de Fonoaudiologia.
07/02/2018,07/02/2018,b'Relat\xc3\xb3rios de Matr\xc3\xadcula e de Integraliza\xc3\xa7\xc3\xa3o Curricular',b'DAC divulga na WEB relat\xc3\xb3rios de matr\xc3\xadcula e de integraliza\xc3\xa7\xc3\xa3o curricular do 1\xc2\xb0 per\xc3\xadodo letivo de 2018.'
07/02/2018,07/02/2018,relatorios de matricula e de integralizacao curricular,DAC divulga na WEB relatórios de matrícula e de integralização curricular do 1° período letivo de 2018.
01/02/2018,01/02/2018,b'Processo Seletivo Aberto',"b'Divulga\xc3\xa7\xc3\xa3o da lista de candidatos convocados para matr\xc3\xadcula do Processo Seletivo Aberto para preenchimento de vagas remanescentes, cursos com Prova de Habilidades Espec\xc3\xadficas.'"
01/02/2018,01/02/2018,processo seletivo aberto,"Divulgação da lista de candidatos convocados para matrícula do Processo Seletivo Aberto para preenchimento de vagas remanescentes, cursos com Prova de Habilidades Específicas."
08/02/2018,08/02/2018,b'Vestibular Unicamp',b'Divulga\xc3\xa7\xc3\xa3o da lista de convocados em 1\xc2\xaa chamada para matr\xc3\xadcula n\xc3\xa3o presencial do Vestibular Unicamp 2018.'
08/02/2018,08/02/2018,vestibular unicamp,Divulgação da lista de convocados em 1ª chamada para matrícula não presencial do Vestibular Unicamp 2018.
08/02/2018,08/02/2018,Processo Seletivo Aberto,"Matrícula e solicitação de Aproveitamento de Estudos para os candidatos aprovados no Processo Seletivo Aberto para preenchimento de vagas remanescentes, cursos com Prova de Habilidades Especificas, na DAC."
09/02/2018,09/02/2018,b'Vestibular Unicamp',"b'Matr\xc3\xadcula, n\xc3\xa3o presencial, dos convocados em 1\xc2\xaa chamada do Vestibular Unicamp 2018, das 8h00 \xc3\xa0s 18h00, na p\xc3\xa1gina eletr\xc3\xb4nica da Comvest.'"
09/02/2018,09/02/2018,vestibular unicamp,"Matrícula, não presencial, dos convocados em 1ª chamada do Vestibular Unicamp 2018, das 8h00 às 18h00, na página eletrônica da Comvest."
10/02/2018,14/02/2018,b'Feriado/Expediente Suspenso',b'N\xc3\xa3o haver\xc3\xa1 atividades.'
10/02/2018,14/02/2018,feriado/expediente suspenso,Não haverá atividades.
15/02/2018,15/02/2018,b'Vestibular Unicamp',"b'Divulga\xc3\xa7\xc3\xa3o da lista de convocados em 2\xc2\xaa chamada para matr\xc3\xadcula presencial do Vestibular Unicamp 2018, \xc3\xa0s 15 horas.'"
15/02/2018,15/02/2018,vestibular unicamp,"Divulgação da lista de convocados em 2ª chamada para matrícula presencial do Vestibular Unicamp 2018, às 15 horas."
16/02/2018,16/02/2018,b'Cat\xc3\xa1logo dos Cursos de Gradua\xc3\xa7\xc3\xa3o',b'\xc3\x9altimo dia para as Coordenadorias de Cursos encaminharem \xc3\xa0 DAC propostas de cria\xc3\xa7\xc3\xa3o/exclus\xc3\xa3o de habilita\xc3\xa7\xc3\xa3o/\xc3\xaanfase em cursos j\xc3\xa1 existentes.'
16/02/2018,16/02/2018,catalogo dos cursos de graduacao,Último dia para as Coordenadorias de Cursos encaminharem à DAC propostas de criação/exclusão de habilitação/ênfase em cursos já existentes.
17/02/2018,17/02/2018,b'F\xc3\xa9rias de Ver\xc3\xa3o',b'T\xc3\xa9rmino das aulas do per\xc3\xadodo de F\xc3\xa9rias de Ver\xc3\xa3o - 2018.'
17/02/2018,17/02/2018,ferias de verao,Término das aulas do período de Férias de Verão - 2018.
19/02/2018,19/02/2018,b'Vestibular Unicamp',"b'Matr\xc3\xadcula presencial dos convocados em 2\xc2\xaa chamada do Vestibular Unicamp 2018, das 9h00 \xc3\xa0s 12h00, nas unidades de ensino.'"
19/02/2018,19/02/2018,vestibular unicamp,"Matrícula presencial dos convocados em 2ª chamada do Vestibular Unicamp 2018, das 9h00 às 12h00, nas unidades de ensino."
19/02/2018,19/02/2018,Vestibular Unicamp,"Solicitação de Aproveitamento de Estudos para o 1º Período letivo de 2018 - ingressantes da 2ª chamada do Vestibular Unicamp 2018, na DAC."
19/02/2018,19/02/2018,Vestibular Unicamp,Divulgação da lista de convocados em 3ª chamada para matrícula presencial e lista de candidatos remanejados do Vestibular Unicamp 2018.
19/02/2018,20/02/2018,b'F\xc3\xa9rias de Ver\xc3\xa3o',b'Exames finais do per\xc3\xadodo de F\xc3\xa9rias de Ver\xc3\xa3o - 2018.'
19/02/2018,20/02/2018,ferias de verao,Exames finais do período de Férias de Verão - 2018.
21/02/2018,21/02/2018,b'Vestibular Unicamp',"b'Matr\xc3\xadcula presencial dos convocados em 3\xc2\xaa chamada do Vestibular Unicamp 2018, das 9h00 \xc3\xa0s 12h00, nas unidades de ensino.'"
21/02/2018,21/02/2018,vestibular unicamp,"Matrícula presencial dos convocados em 3ª chamada do Vestibular Unicamp 2018, das 9h00 às 12h00, nas unidades de ensino."
21/02/2018,21/02/2018,Vestibular Unicamp,"Solicitação de Aproveitamento de Estudos para o 1º Período letivo de 2018 - ingressantes da 3ª chamada do Vestibular Unicamp 2018, na DAC."
21/02/2018,21/02/2018,Férias de Verão,"Último dia para entrada de médias e frequências do período de Férias de Verão - 2018, na WEB."
21/02/2018,22/02/2018,b'Processo Seletivo Aberto',"b'Matr\xc3\xadcula em disciplinas dos candidatos aprovados no Processo Seletivo Aberto para preenchimento de vagas remanescentes, na DAC.'"
21/02/2018,22/02/2018,processo seletivo aberto,"Matrícula em disciplinas dos candidatos aprovados no Processo Seletivo Aberto para preenchimento de vagas remanescentes, na DAC."
25/02/2018,27/02/2018,b'Altera\xc3\xa7\xc3\xa3o de Matr\xc3\xadcula',"b'Altera\xc3\xa7\xc3\xa3o de Matr\xc3\xadcula em disciplinas do 1\xc2\xba per\xc3\xadodo letivo de 2018, na WEB.'"
25/02/2018,27/02/2018,alteracao de matricula,"Alteração de Matrícula em disciplinas do 1º período letivo de 2018, na WEB."
26/02/2018,26/02/2018,b'Per\xc3\xadodo Letivo',b'In\xc3\xadcio das aulas do 1\xc2\xba per\xc3\xadodo letivo de 2018 e Turmas Especiais I e II.'
26/02/2018,26/02/2018,periodo letivo,Início das aulas do 1º período letivo de 2018 e Turmas Especiais I e II.
26/02/2018,26/02/2018,Vestibular Unicamp,"Confirmação de Matrícula para todos os candidatos matriculados em decorrência das 1ª, 2ª e 3ª chamadas do Vestibular Unicamp 2018, das 9h às 16h, nas unidades de ensino. Os alunos dos cursos oferecidos no turno noturno poderão confirmar suas matrículas das 18h00 às 21h00."
26/02/2018,26/02/2018,Vestibular Unicamp,"Identificação civil dos alunos que fizeram matrícula nas 1ª, 2ª e 3ª chamadas do Vestibular Unicamp 2018."
26/02/2018,01/03/2018,b'Altera\xc3\xa7\xc3\xa3o de Matr\xc3\xadcula',b'Coordenadorias de Cursos atuam nos pedidos de Altera\xc3\xa7\xc3\xa3o de Matr\xc3\xadcula do 1\xc2\xba per\xc3\xadodo letivo de 2018.'
26/02/2018,01/03/2018,alteracao de matricula,Coordenadorias de Cursos atuam nos pedidos de Alteração de Matrícula do 1º período letivo de 2018.
27/02/2018,27/02/2018,b'Estudante Especial',"b'\xc3\x9altimo dia para inscri\xc3\xa7\xc3\xa3o de Estudante Especial em disciplinas isoladas de gradua\xc3\xa7\xc3\xa3o do 1\xc2\xba per\xc3\xadodo letivo de 2018, na WEB.'"
27/02/2018,27/02/2018,estudante especial,"Último dia para inscrição de Estudante Especial em disciplinas isoladas de graduação do 1º período letivo de 2018, na WEB."
27/02/2018,01/03/2018,b'Vestibular Unicamp',"b'Declara\xc3\xa7\xc3\xa3o de interesse por vaga do Vestibular Unicamp 2018, das 9h00 do dia 27 de fevereiro at\xc3\xa9 \xc3\xa0s 17h00 do dia 01 de mar\xc3\xa7o, na p\xc3\xa1gina eletr\xc3\xb4nica da Comvest.'"
27/02/2018,01/03/2018,vestibular unicamp,"Declaração de interesse por vaga do Vestibular Unicamp 2018, das 9h00 do dia 27 de fevereiro até às 17h00 do dia 01 de março, na página eletrônica da Comvest."
27/02/2018,30/05/2018,b'Hor\xc3\xa1rio',b'Coordenadorias de Cursos elaboram os hor\xc3\xa1rios do 2\xc2\xba per\xc3\xadodo letivo de 2018 e Sistema de Recupera\xc3\xa7\xc3\xa3o.'
27/02/2018,30/05/2018,horario,Coordenadorias de Cursos elaboram os horários do 2º período letivo de 2018 e Sistema de Recuperação.
28/02/2018,01/03/2018,b'Estudante Especial',b'Coordenadorias de Cursos atuam nos pedidos de inscri\xc3\xa7\xc3\xa3o de Estudante Especial em disciplinas isoladas de gradua\xc3\xa7\xc3\xa3o do 1\xc2\xba per\xc3\xadodo letivo de 2018.'
28/02/2018,01/03/2018,estudante especial,Coordenadorias de Cursos atuam nos pedidos de inscrição de Estudante Especial em disciplinas isoladas de graduação do 1º período letivo de 2018.
01/03/2018,01/03/2018,b'Vestibular Unicamp',"b'\xc3\x9altimo dia para Declara\xc3\xa7\xc3\xa3o de interesse por vaga do Vestibular Unicamp 2018, at\xc3\xa9 \xc3\xa0s 17h00, na p\xc3\xa1gina eletr\xc3\xb4nica da Comvest.'"
01/03/2018,01/03/2018,vestibular unicamp,"Último dia para Declaração de interesse por vaga do Vestibular Unicamp 2018, até às 17h00, na página eletrônica da Comvest."
01/03/2018,01/03/2018,Alteração de Matrícula,Último dia para as Coordenadorias de Cursos atuarem nos pedidos de Alteração de Matrícula do 1º período letivo de 2018.
01/03/2018,01/03/2018,Estudante Especial,Último dia para as Coordenadorias de Cursos atuarem nos pedidos de inscrição de Estudante Especial em disciplinas isoladas de graduação do 1º período letivo de 2018.
02/03/2018,02/03/2018,b'Estudante Especial',b'DAC divulga na WEB relat\xc3\xb3rios de matr\xc3\xadcula de estudante especial em disciplinas isoladas de gradua\xc3\xa7\xc3\xa3o do 1\xc2\xba per\xc3\xadodo letivo de 2018.'
02/03/2018,02/03/2018,estudante especial,DAC divulga na WEB relatórios de matrícula de estudante especial em disciplinas isoladas de graduação do 1º período letivo de 2018.
02/03/2018,02/04/2018,b'Cola\xc3\xa7\xc3\xa3o de Grau',b'Coordenadorias de Cursos informam \xc3\xa0 DAC a data da Cola\xc3\xa7\xc3\xa3o de Grau \xc2\xa0do 1\xc2\xba per\xc3\xadodo letivo de 2018.'
02/03/2018,02/04/2018,colacao de grau,Coordenadorias de Cursos informam à DAC a data da Colação de Grau  do 1º período letivo de 2018.
02/03/2018,02/05/2018,b'Desist\xc3\xaancia de Matr\xc3\xadcula em disciplina',"b'Desist\xc3\xaancia de Matr\xc3\xadcula em Disciplinas do 1\xc2\xba per\xc3\xadodo letivo de 2018, na WEB'"
02/03/2018,02/05/2018,desistencia de matricula em disciplina,"Desistência de Matrícula em Disciplinas do 1º período letivo de 2018, na WEB"
05/03/2018,05/03/2018,b'Vestibular Unicamp',b'Divulga\xc3\xa7\xc3\xa3o da lista de convocados em 4\xc2\xaa chamada para matr\xc3\xadcula presencial e lista de candidatos remanejados do Vestibular Unicamp 2018.'
05/03/2018,05/03/2018,vestibular unicamp,Divulgação da lista de convocados em 4ª chamada para matrícula presencial e lista de candidatos remanejados do Vestibular Unicamp 2018.
07/03/2018,07/03/2018,b'Vestibular Unicamp',"b'Matr\xc3\xadcula presencial dos convocados em 4\xc2\xaa chamada do Vestibular Unicamp 2018, das 9h00 \xc3\xa0s 12h00, nas unidades de ensino.'"
07/03/2018,07/03/2018,vestibular unicamp,"Matrícula presencial dos convocados em 4ª chamada do Vestibular Unicamp 2018, das 9h00 às 12h00, nas unidades de ensino."
07/03/2018,07/03/2018,Vestibular Unicamp,Identificação civil dos alunos que fizeram matrícula em 4ª chamada do Vestibular Unicamp 2018.
07/03/2018,07/03/2018,Vestibular Unicamp,"Solicitação de Aproveitamento de Estudos para o 1º Período letivo de 2018 - ingressantes da 4ª chamada do Vestibular Unicamp 2018, na DAC."
07/03/2018,07/03/2018,Vestibular Unicamp,Divulgação da lista de convocados em 5ª chamada para matrícula presencial e lista de candidatos remanejados do Vestibular Unicamp 2018.
09/03/2018,09/03/2018,b'Vestibular Unicamp',"b'Matr\xc3\xadcula presencial dos convocados em 5\xc2\xaa chamada do Vestibular Unicamp 2018, das 9h00 \xc3\xa0s 12h00, nas unidades de ensino.'"
09/03/2018,09/03/2018,vestibular unicamp,"Matrícula presencial dos convocados em 5ª chamada do Vestibular Unicamp 2018, das 9h00 às 12h00, nas unidades de ensino."
09/03/2018,09/03/2018,Vestibular Unicamp,Identificação civil dos alunos que fizeram matrícula em 5ª chamada do Vestibular Unicamp 2018.
09/03/2018,09/03/2018,Vestibular Unicamp,"Solicitação de Aproveitamento de Estudos para o 1º Período letivo de 2018 - ingressantes da 5ª chamada do Vestibular Unicamp 2018, na DAC."
09/03/2018,09/03/2018,Vestibular Unicamp,Divulgação da lista de convocados em 6ª chamada para matrícula presencial e lista de candidatos remanejados do Vestibular Unicamp 2018.
09/03/2018,09/03/2018,Catálogo dos Cursos de Graduação,Último dia para as Coordenadorias de Cursos encaminharem à DAC as propostas de alterações curriculares de Catálogos Vigentes a vigorarem a partir do 2º Período letivo de 2018.
09/03/2018,09/03/2018,Catálogo dos Cursos de Graduação,Coordenadorias de Cursos tomam conhecimento dos pareceres da DAC nas propostas de criação/exclusão de habilitação/ênfase em cursos já existentes a serem submetidos às subcomissões da CCG.
12/03/2018,12/03/2018,b'Vestibular Unicamp',"b'Assinatura da lista de chamada dos alunos ingressantes que compareceram nas duas primeiras semanas de aulas, das 9h00 \xc3\xa0s 16h00, nas unidades de ensino. Os alunos dos cursos oferecidos no turno noturno poder\xc3\xa3o assinar a lista de chamada das 19h00 \xc3\xa0s 21h00.'"
12/03/2018,12/03/2018,vestibular unicamp,"Assinatura da lista de chamada dos alunos ingressantes que compareceram nas duas primeiras semanas de aulas, das 9h00 às 16h00, nas unidades de ensino. Os alunos dos cursos oferecidos no turno noturno poderão assinar a lista de chamada das 19h00 às 21h00."
13/03/2018,13/03/2018,b'Vestibular Unicamp',"b'Matr\xc3\xadcula presencial dos convocados em 6\xc2\xaa chamada do Vestibular Unicamp 2018, das 9h00 \xc3\xa0s 12h00, nas unidades de ensino.'"
13/03/2018,13/03/2018,vestibular unicamp,"Matrícula presencial dos convocados em 6ª chamada do Vestibular Unicamp 2018, das 9h00 às 12h00, nas unidades de ensino."
13/03/2018,13/03/2018,Vestibular Unicamp,Identificação civil dos alunos que fizeram matrícula em 6ª chamada do Vestibular Unicamp 2018.
13/03/2018,13/03/2018,Vestibular Unicamp,"Solicitação de Aproveitamento de Estudos para o 1º Período letivo de 2018 - ingressantes da 6ª chamada do Vestibular Unicamp 2018, na DAC."
13/03/2018,13/03/2018,Vestibular Unicamp,Divulgação da lista de convocados em 7ª chamada para matrícula presencial e lista de candidatos remanejados do Vestibular Unicamp 2018.
13/03/2018,16/03/2018,b'Cat\xc3\xa1logo dos Cursos de Gradua\xc3\xa7\xc3\xa3o',b'Prazo para as subcomiss\xc3\xb5es da CCG emitirem pareceres nas propostas de cria\xc3\xa7\xc3\xa3o/exclus\xc3\xa3o de habilita\xc3\xa7\xc3\xa3o/\xc3\xaanfase em cursos j\xc3\xa1 existentes.'
13/03/2018,16/03/2018,catalogo dos cursos de graduacao,Prazo para as subcomissões da CCG emitirem pareceres nas propostas de criação/exclusão de habilitação/ênfase em cursos já existentes.
15/03/2018,15/03/2018,b'Vestibular Unicamp',"b'Matr\xc3\xadcula presencial dos convocados em 7\xc2\xaa chamada do Vestibular Unicamp 2018, das 9h00 \xc3\xa0s 12h00, nas unidades de ensino.'"
15/03/2018,15/03/2018,vestibular unicamp,"Matrícula presencial dos convocados em 7ª chamada do Vestibular Unicamp 2018, das 9h00 às 12h00, nas unidades de ensino."
15/03/2018,15/03/2018,Vestibular Unicamp,Identificação civil dos alunos que fizeram matrícula em 7ª chamada do Vestibular Unicamp 2018.
15/03/2018,15/03/2018,Vestibular Unicamp,"Solicitação de Aproveitamento de Estudos para o 1º Período letivo de 2018 - ingressantes da 7ª chamada do Vestibular Unicamp 2018, na DAC."
15/03/2018,15/03/2018,Vestibular Unicamp,Divulgação da lista de convocados em 8ª chamada para matrícula presencial e lista de candidatos remanejados do Vestibular Unicamp 2018.
19/03/2018,19/03/2018,b'Vestibular Unicamp',"b'Matr\xc3\xadcula presencial dos convocados em 8\xc2\xaa chamada do Vestibular Unicamp 2018, das 9h00 \xc3\xa0s 12h00, nas unidades de ensino.'"
19/03/2018,19/03/2018,vestibular unicamp,"Matrícula presencial dos convocados em 8ª chamada do Vestibular Unicamp 2018, das 9h00 às 12h00, nas unidades de ensino."
19/03/2018,19/03/2018,Vestibular Unicamp,Identificação civil dos alunos que fizeram matrícula em 8ª chamada do Vestibular Unicamp 2018.
19/03/2018,19/03/2018,Vestibular Unicamp,"Solicitação de Aproveitamento de Estudos para o 1º período letivo de 2018 - ingressantes da 8ª chamada do Vestibular Unicamp 2018, na DAC."
19/03/2018,19/03/2018,Vestibular Unicamp,Divulgação da lista de convocados para matrícula presencial em 9ª chamada e lista de candidatos remanejados do Vestibular Unicamp 2018.
19/03/2018,19/03/2018,Média e Frequência,Último dia para as unidades de ensino encaminharem à DAC retificação de Média Final e Frequência do 2º período letivo de 2017.
19/03/2018,19/03/2018,Catálogo dos Cursos de Graduação,Coordenadorias de Cursos tomam conhecimento dos pareceres das subcomissões da CCG nas propostas de criação/exclusão de habilitação/ênfase em cursos já existentes.
21/03/2018,21/03/2018,b'Vestibular Unicamp',"b'Matr\xc3\xadcula presencial dos convocados em 9\xc2\xaa chamada do Vestibular Unicamp 2018, das 9h00 \xc3\xa0s 12h00, nas unidades de ensino.'"
21/03/2018,21/03/2018,vestibular unicamp,"Matrícula presencial dos convocados em 9ª chamada do Vestibular Unicamp 2018, das 9h00 às 12h00, nas unidades de ensino."
21/03/2018,21/03/2018,Vestibular Unicamp,Identificação civil dos alunos que fizeram matrícula em 9ª chamada do Vestibular Unicamp 2018.
21/03/2018,21/03/2018,Vestibular Unicamp,"Solicitação de Aproveitamento de Estudos para o 1º período letivo de 2018 - ingressantes da 9ª chamada do Vestibular Unicamp 2018, na DAC."
23/03/2018,23/03/2018,b'Vestibular Unicamp',"b'Divulga\xc3\xa7\xc3\xa3o da lista de convocados em 10\xc2\xaa chamada para matr\xc3\xadcula presencial, lista de espera e lista de candidatos remanejados do Vestibular Unicamp 2018.'"
23/03/2018,23/03/2018,vestibular unicamp,"Divulgação da lista de convocados em 10ª chamada para matrícula presencial, lista de espera e lista de candidatos remanejados do Vestibular Unicamp 2018."
23/03/2018,23/03/2018,Teste de Proficiência,"Divulgação das disciplinas de línguas estrangeiras a serem oferecidas em Teste de Proficiência, na WEB."
